[{"version_a":"v4.0.0","version_b":"v6.0.2-SNAPSHOT-pr1063-b617439","n_common":15,"n_valid":15,"n_nan_a":0,"n_nan_b":0,"n_only_a":0,"n_only_b":0,"silence_threshold":-89.0,"max_delta":9.4196,"mean_delta":4.4297,"std_delta":3.0064,"rmse":5.3536,"scatter":[[58.79,62.58],[51.94,60.1],[30.24,35.53],[43.71,53.13],[30.33,33.39],[54.6,55.54],[31.65,39.99],[49.29,54.63],[49.3,49.58],[84.38,84.46],[87.37,87.39],[58.79,63.25],[39.87,47.37],[41.82,46.87],[62.13,66.83]],"deltas_signed":[3.79,8.16,5.29,9.42,3.06,0.94,8.34,5.34,0.28,0.08,0.02,4.46,7.5,5.05,4.7],"diff_map":[[345695.806,6686955.457,3.79],[345347.567,6687095.256,8.16],[344827.874,6687672.1,5.29],[346060.43,6686803.28,9.42],[344679.284,6687419.129,3.06],[345567.274,6687763.705,0.94],[346231.537,6686601.956,8.34],[345855.782,6686842.235,5.34],[345043.943,6686991.045,0.28],[345560.256,6687172.909,0.08],[345550.565,6687178.781,0.02],[345705.525,6686943.03,4.46],[345953.32,6686782.293,7.5],[346120.637,6686657.928,5.05],[345724.101,6687123.119,4.7]]},{"version_a":"v4.0.1","version_b":"v6.0.2-SNAPSHOT-pr1063-b617439","n_common":15,"n_valid":15,"n_nan_a":0,"n_nan_b":0,"n_only_a":0,"n_only_b":0,"silence_threshold":-89.0,"max_delta":9.4196,"mean_delta":4.4297,"std_delta":3.0064,"rmse":5.3536,"scatter":[[58.79,62.58],[51.94,60.1],[30.24,35.53],[43.71,53.13],[30.33,33.39],[54.6,55.54],[31.65,39.99],[49.29,54.63],[49.3,49.58],[84.38,84.46],[87.37,87.39],[58.79,63.25],[39.87,47.37],[41.82,46.87],[62.13,66.83]],"deltas_signed":[3.79,8.16,5.29,9.42,3.06,0.94,8.34,5.34,0.28,0.08,0.02,4.46,7.5,5.05,4.7],"diff_map":[[345695.806,6686955.457,3.79],[345347.567,6687095.256,8.16],[344827.874,6687672.1,5.29],[346060.43,6686803.28,9.42],[344679.284,6687419.129,3.06],[345567.274,6687763.705,0.94],[346231.537,6686601.956,8.34],[345855.782,6686842.235,5.34],[345043.943,6686991.045,0.28],[345560.256,6687172.909,0.08],[345550.565,6687178.781,0.02],[345705.525,6686943.03,4.46],[345953.32,6686782.293,7.5],[346120.637,6686657.928,5.05],[345724.101,6687123.119,4.7]]},{"version_a":"v4.0.2","version_b":"v6.0.2-SNAPSHOT-pr1063-b617439","n_common":15,"n_valid":15,"n_nan_a":0,"n_nan_b":0,"n_only_a":0,"n_only_b":0,"silence_threshold":-89.0,"max_delta":9.3996,"mean_delta":4.1187,"std_delta":2.9759,"rmse":5.0814,"scatter":[[59.17,62.58],[52.34,60.1],[30.74,35.53],[43.73,53.13],[35.49,33.39],[54.6,55.54],[31.75,39.99],[49.29,54.63],[49.32,49.58],[84.38,84.46],[87.37,87.39],[60.02,63.25],[40.26,47.37],[42.34,46.87],[62.27,66.83]],"deltas_signed":[3.41,7.76,4.79,9.4,-2.1,0.94,8.24,5.34,0.26,0.08,0.02,3.23,7.11,4.53,4.56],"diff_map":[[345695.806,6686955.457,3.41],[345347.567,6687095.256,7.76],[344827.874,6687672.1,4.79],[346060.43,6686803.28,9.4],[344679.284,6687419.129,-2.1],[345567.274,6687763.705,0.94],[346231.537,6686601.956,8.24],[345855.782,6686842.235,5.34],[345043.943,6686991.045,0.26],[345560.256,6687172.909,0.08],[345550.565,6687178.781,0.02],[345705.525,6686943.03,3.23],[345953.32,6686782.293,7.11],[346120.637,6686657.928,4.53],[345724.101,6687123.119,4.56]]},{"version_a":"v4.0.4","version_b":"v6.0.2-SNAPSHOT-pr1063-b617439","n_common":15,"n_valid":15,"n_nan_a":0,"n_nan_b":0,"n_only_a":0,"n_only_b":0,"silence_threshold":-89.0,"max_delta":9.3996,"mean_delta":4.1187,"std_delta":2.9759,"rmse":5.0814,"scatter":[[59.17,62.58],[52.34,60.1],[30.74,35.53],[43.73,53.13],[35.49,33.39],[54.6,55.54],[31.75,39.99],[49.29,54.63],[49.32,49.58],[84.38,84.46],[87.37,87.39],[60.02,63.25],[40.26,47.37],[42.34,46.87],[62.27,66.83]],"deltas_signed":[3.41,7.76,4.79,9.4,-2.1,0.94,8.24,5.34,0.26,0.08,0.02,3.23,7.11,4.53,4.56],"diff_map":[[345695.806,6686955.457,3.41],[345347.567,6687095.256,7.76],[344827.874,6687672.1,4.79],[346060.43,6686803.28,9.4],[344679.284,6687419.129,-2.1],[345567.274,6687763.705,0.94],[346231.537,6686601.956,8.24],[345855.782,6686842.235,5.34],[345043.943,6686991.045,0.26],[345560.256,6687172.909,0.08],[345550.565,6687178.781,0.02],[345705.525,6686943.03,3.23],[345953.32,6686782.293,7.11],[346120.637,6686657.928,4.53],[345724.101,6687123.119,4.56]]},{"version_a":"v4.0.5","version_b":"v6.0.2-SNAPSHOT-pr1063-b617439","n_common":15,"n_valid":15,"n_nan_a":0,"n_nan_b":0,"n_only_a":0,"n_only_b":0,"silence_threshold":-89.0,"max_delta":12.3255,"mean_delta":5.1403,"std_delta":3.2959,"rmse":6.1062,"scatter":[[58.18,62.58],[47.77,60.1],[29.95,35.53],[43.71,53.13],[30.4,33.39],[54.6,55.54],[31.75,39.99],[49.29,54.63],[44.05,49.58],[84.38,84.46],[87.37,87.39],[59.29,63.25],[40.27,47.37],[42.46,46.87],[60.08,66.83]],"deltas_signed":[4.4,12.33,5.58,9.42,2.99,0.94,8.24,5.34,5.53,0.08,0.02,3.96,7.1,4.41,6.75],"diff_map":[[345695.806,6686955.457,4.4],[345347.567,6687095.256,12.33],[344827.874,6687672.1,5.58],[346060.43,6686803.28,9.42],[344679.284,6687419.129,2.99],[345567.274,6687763.705,0.94],[346231.537,6686601.956,8.24],[345855.782,6686842.235,5.34],[345043.943,6686991.045,5.53],[345560.256,6687172.909,0.08],[345550.565,6687178.781,0.02],[345705.525,6686943.03,3.96],[345953.32,6686782.293,7.1],[346120.637,6686657.928,4.41],[345724.101,6687123.119,6.75]]},{"version_a":"v5.0.0","version_b":"v6.0.2-SNAPSHOT-pr1063-b617439","n_common":15,"n_valid":15,"n_nan_a":0,"n_nan_b":0,"n_only_a":0,"n_only_b":0,"silence_threshold":-89.0,"max_delta":37.7255,"mean_delta":20.8682,"std_delta":11.5198,"rmse":23.8367,"scatter":[[81.66,62.58],[72.64,60.1],[71.34,35.53],[75.59,53.13],[71.12,33.39],[71.88,55.54],[75.15,39.99],[72.72,54.63],[78.93,49.58],[84.69,84.46],[85.45,87.39],[77.94,63.25],[76.92,47.37],[77.02,46.87],[76.77,66.83]],"deltas_signed":[-19.09,-12.54,-35.81,-22.46,-37.73,-16.34,-35.16,-18.08,-29.34,-0.23,1.94,-14.68,-29.55,-30.15,-9.93],"diff_map":[[345695.806,6686955.457,-19.09],[345347.567,6687095.256,-12.54],[344827.874,6687672.1,-35.81],[346060.43,6686803.28,-22.46],[344679.284,6687419.129,-37.73],[345567.274,6687763.705,-16.34],[346231.537,6686601.956,-35.16],[345855.782,6686842.235,-18.08],[345043.943,6686991.045,-29.34],[345560.256,6687172.909,-0.23],[345550.565,6687178.781,1.94],[345705.525,6686943.03,-14.68],[345953.32,6686782.293,-29.55],[346120.637,6686657.928,-30.15],[345724.101,6687123.119,-9.93]]},{"version_a":"v5.0.1","version_b":"v6.0.2-SNAPSHOT-pr1063-b617439","n_common":15,"n_valid":15,"n_nan_a":0,"n_nan_b":0,"n_only_a":0,"n_only_b":0,"silence_threshold":-89.0,"max_delta":10.1713,"mean_delta":4.9254,"std_delta":2.598,"rmse":5.5686,"scatter":[[68.21,62.58],[54.01,60.1],[30.02,35.53],[43.76,53.13],[30.42,33.39],[59.34,55.54],[50.16,39.99],[55.6,54.63],[46.98,49.58],[86.72,84.46],[89.08,87.39],[67.74,63.25],[40.25,47.37],[42.31,46.87],[60.19,66.83]],"deltas_signed":[-5.63,6.08,5.51,9.37,2.97,-3.81,-10.17,-0.97,2.61,-2.26,-1.69,-4.49,7.12,4.56,6.64],"diff_map":[[345695.806,6686955.457,-5.63],[345347.567,6687095.256,6.08],[344827.874,6687672.1,5.51],[346060.43,6686803.28,9.37],[344679.284,6687419.129,2.97],[345567.274,6687763.705,-3.81],[346231.537,6686601.956,-10.17],[345855.782,6686842.235,-0.97],[345043.943,6686991.045,2.61],[345560.256,6687172.909,-2.26],[345550.565,6687178.781,-1.69],[345705.525,6686943.03,-4.49],[345953.32,6686782.293,7.12],[346120.637,6686657.928,4.56],[345724.101,6687123.119,6.64]]},{"version_a":"v6.0.0","version_b":"v6.0.2-SNAPSHOT-pr1063-b617439","n_common":15,"n_valid":15,"n_nan_a":0,"n_nan_b":0,"n_only_a":0,"n_only_b":0,"silence_threshold":-89.0,"max_delta":8.4659,"mean_delta":3.8942,"std_delta":2.3743,"rmse":4.561,"scatter":[[66.77,62.58],[54.2,60.1],[30.66,35.53],[44.66,53.13],[31.95,33.39],[58.25,55.54],[47.35,39.99],[54.36,54.63],[47.73,49.58],[86.72,84.46],[89.07,87.39],[66.72,63.25],[42.08,47.37],[44.97,46.87],[60.08,66.83]],"deltas_signed":[-4.2,5.9,4.87,8.47,1.44,-2.72,-7.36,0.27,1.85,-2.26,-1.67,-3.46,5.29,1.9,6.75],"diff_map":[[345695.806,6686955.457,-4.2],[345347.567,6687095.256,5.9],[344827.874,6687672.1,4.87],[346060.43,6686803.28,8.47],[344679.284,6687419.129,1.44],[345567.274,6687763.705,-2.72],[346231.537,6686601.956,-7.36],[345855.782,6686842.235,0.27],[345043.943,6686991.045,1.85],[345560.256,6687172.909,-2.26],[345550.565,6687178.781,-1.67],[345705.525,6686943.03,-3.46],[345953.32,6686782.293,5.29],[346120.637,6686657.928,1.9],[345724.101,6687123.119,6.75]]},{"version_a":"v6.0.1","version_b":"v6.0.2-SNAPSHOT-pr1063-b617439","n_common":15,"n_valid":15,"n_nan_a":0,"n_nan_b":0,"n_only_a":0,"n_only_b":0,"silence_threshold":-89.0,"max_delta":6.6166,"mean_delta":1.6755,"std_delta":2.2884,"rmse":2.8362,"scatter":[[62.57,62.58],[60.1,60.1],[29.49,35.53],[51.06,53.13],[31.1,33.39],[54.6,55.54],[33.38,39.99],[54.6,54.63],[49.55,49.58],[84.46,84.46],[87.39,87.39],[63.23,63.25],[42.28,47.37],[44.88,46.87],[66.83,66.83]],"deltas_signed":[0.0,0.0,6.05,2.07,2.29,0.94,6.62,0.03,0.03,0.0,0.0,0.02,5.1,1.99,0.0],"diff_map":[[345695.806,6686955.457,0.0],[345347.567,6687095.256,0.0],[344827.874,6687672.1,6.05],[346060.43,6686803.28,2.07],[344679.284,6687419.129,2.29],[345567.274,6687763.705,0.94],[346231.537,6686601.956,6.62],[345855.782,6686842.235,0.03],[345043.943,6686991.045,0.03],[345560.256,6687172.909,0.0],[345550.565,6687178.781,0.0],[345705.525,6686943.03,0.02],[345953.32,6686782.293,5.1],[346120.637,6686657.928,1.99],[345724.101,6687123.119,0.0]]},{"version_a":"v6.0.2-SNAPSHOT","version_b":"v6.0.2-SNAPSHOT-pr1063-b617439","n_common":15,"n_valid":15,"n_nan_a":0,"n_nan_b":0,"n_only_a":0,"n_only_b":0,"silence_threshold":-89.0,"max_delta":0.0,"mean_delta":0.0,"std_delta":0.0,"rmse":0.0,"scatter":[[62.58,62.58],[60.1,60.1],[35.53,35.53],[53.13,53.13],[33.39,33.39],[55.54,55.54],[39.99,39.99],[54.63,54.63],[49.58,49.58],[84.46,84.46],[87.39,87.39],[63.25,63.25],[47.37,47.37],[46.87,46.87],[66.83,66.83]],"deltas_signed":[0.0,0.0,0.0,0.0,0.0,0.0,0.0,0.0,0.0,0.0,0.0,0.0,0.0,0.0,0.0],"diff_map":[[345695.806,6686955.457,0.0],[345347.567,6687095.256,0.0],[344827.874,6687672.1,0.0],[346060.43,6686803.28,0.0],[344679.284,6687419.129,0.0],[345567.274,6687763.705,0.0],[346231.537,6686601.956,0.0],[345855.782,6686842.235,0.0],[345043.943,6686991.045,0.0],[345560.256,6687172.909,0.0],